Article_Title,Year,Description,Revue,Volume,Number,Pages
Composition of pseudo almost periodic functions and Cauchy problems with operator of non dense domain,1999,"Annales Mathématiques Blaise Pascal 6 (1), 1-11, 1999",Annales Mathématiques Blaise Pascal,6,1,111
Feedback stabilization of a class of evolution equations with delay,2009,"Journal of Evolution Equations 9, 103-121, 2009",Journal of Evolution Equations,9,,103121
Almost periodicity of inhomogeneous parabolic evolution equations,2019,"Evolution equations, 299-318, 2019","Evolution equations,",299318,,
Almost periodic solutions to some semilinear non-autonomous thermoelastic plate equations,2009,"Journal of Mathematical Analysis and Applications 349 (1), 74-84, 2009",Journal of Mathematical Analysis and Applications,349,1,7484
Almost automorphic solutions for hyperbolic semilinear evolution equations,2005,"Semigroup Forum 71, 231-240, 2005",Semigroup Forum,71,,231240
Null controllability of degenerate parabolic cascade systems,2011,"Portugaliae Mathematica 68 (3), 345-367, 2011",Portugaliae Mathematica,68,3,345367
Null controllability for parabolic equations with dynamic boundary conditions,2017,"Evol. Equ. Control Theory 6 (3), 381-407, 2017",Evol. Equ. Control Theory,6,3,381407
Linear delay equations in the Lp-context,2019,"Evolution equations, 319-330, 2019","Evolution equations,",319330,,
Lipschitz stability for linear parabolic systems with interior degeneracy,2014,"Electron. J. Differential Equations 2014, 1-26, 2014",Electron. J. Differential Equations,2014,,126
Carleman estimates and null controllability of coupled degenerate systems,2011,"arXiv preprint arXiv:1111.3665, 2011",arXiv preprint arXiv:,11113665,,
Almost automorphy of semilinear parabolic evolution equations.,2008,"Electronic Journal of Differential Equations (EJDE)[electronic only] 2008 …, 2008",Electronic Journal of Differential Equations (EJDE)[electronic only],2008,,
Existence and uniqueness of C (n)-almost periodic solutions to some ordinary differential equations,2007,"Nonlinear Analysis: Theory, Methods & Applications 66 (9), 1899-1910, 2007","Nonlinear Analysis: Theory, Methods & Applications",66,9,18991910
Carleman estimates for parabolic equations with interior degeneracy and Neumann boundary conditions,2018,"Journal d'Analyse Mathématique 135, 1-35, 2018",Journal d'Analyse Mathématique,135,,135
Null controllability of a model in population dynamics,2014,"Electronic journal of differential equations 2014 (240), 1-20, 2014",Electronic journal of differential equations,2014,240,120
Extrapolation and inhornogeneous retarded differential equations on infinite dimensional spaces,1998,"Rendiconti del Circolo Matematico di Palermo 47, 331-346, 1998",Rendiconti del Circolo Matematico di Palermo,47,,331346
Regularity properties of perturbed Hille-Yosida operators and retarded differential equations,2001,"Semigroup Forum 64, 55-70, 2001",Semigroup Forum,64,,5570
Controllability of semilinear boundary problems with nonlocal initial conditions,2006,"Journal of mathematical analysis and applications 316 (2), 566-578, 2006",Journal of mathematical analysis and applications,316,2,566578
Null controllability of a population dynamics with degenerate diffusion,2013,,,,,
The asymptotic behavior of a population equation with diffusion and delayed birth process,2007,"Discrete and Continuous Dynamical Systems-B 7 (4), 735-754, 2007",Discrete and Continuous Dynamical Systems-B,7,4,735754
Existence and asymptotic behavior of solutions of semilinear Cauchy problems with non dense domain via extrapolation spaces,2000,"Rendiconti del Circolo Matematico di Palermo 49, 481-496, 2000",Rendiconti del Circolo Matematico di Palermo,49,,481496
Improved mechanical properties of k-carrageenan-based nanocomposite films reinforced with cellulose nanocrystals,2019,"International Journal of Biological Macromolecules 123, 1248-1256, 2019",International Journal of Biological Macromolecules,123,,12481256
Synthesis and Toxicity of Graphene Oxide Nanoparticles: A Literature Review of In Vitro and In Vivo Studies,2021,"BioMed Research International 2021, 19 pages, 2021",BioMed Research International,2021,,19
"Adsorption of crystal violet onto an agricultural waste residue: kinetics, isotherm, thermodynamics, and mechanism of adsorption",2020,"The Scientific World Journal 2020, 2020",The Scientific World Journal,2020,,
"Accumulation and toxicological effects of cadmium, copper and zinc on the growth and photosynthesis of the freshwater diatom Planothidium lanceolatum (Brébisson) Lange-Bertalot",2012,"Journal of Materials and Environmental Science 3 (3), 2012",Journal of Materials and Environmental Science,3,3,
Machine learning algorithms for efficient water quality prediction,2022,"Modeling Earth Systems and Environment 8 (2), 2793-2801, 2022",Modeling Earth Systems and Environment,8,2,27932801
Reuse of treated wastewater in agriculture: solving water deficit problems in arid areas,2014,"Annals of West University of Timisoara: Series of Biology 17 (2), 2014",Annals of West University of Timisoara: Series of Biology,17,2,
Antidiabetic potential of Caralluma europaea against alloxan-induced diabetes in mice,2019,"Saudi journal of biological sciences 26 (6), 1171-1178, 2019",Saudi journal of biological sciences,26,6,11711178
Composites with alginate beads: A novel design of nano-adsorbents impregnation for large-scale continuous flow wastewater treatment pilots,2020,"Saudi Journal of Biological Sciences 27 (10), 2499-2508, 2020",Saudi Journal of Biological Sciences,27,10,24992508
Impact of fertilization by natural manure on the microbial quality of soil: Mo-lecular Approach,2017,"Saudi Journal of Biological Sciences 24 (6), 1437-1443, 2017",Saudi Journal of Biological Sciences,24,6,14371443
Biotechnological approach of greywater treatment and reuse for landscape irrigation in small communities,2019,"Saudi journal of biological sciences 26 (1), 83-90, 2019",Saudi journal of biological sciences,26,1,8390
Assessment of biogas and biofertilizer produced from anaerobic co-digestion of olive mill wastewater with municipal wastewater and cow dung,2020,"Environmental Technology & Innovation 20, 101152, 2020",Environmental Technology & Innovation,20,,101152
Effect of plasticizers on physicochemical properties of cellulose nanocrystals filled alginate bionanocomposite films,2018,"Advances in Polymer Technology 37 (8), 3171-3185, 2018",Advances in Polymer Technology,37,8,31713185
Review on cow manure as renewable energy,2020,"Smart Village Technology: Concepts and Developments, 341-352, 2020","Smart Village Technology: Concepts and Developments,",341352,,
Inhibiting effect of textile wastewater on the activity of sludge from the biological treatment process of the activated sludge plant,2019,"Saudi Journal of biological sciences 26 (7), 1753-1757, 2019",Saudi Journal of biological sciences,26,7,17531757
Inoculation with selected indigenous mycorrhizal complex improves Ceratonia siliqua’s growth and response to drought stress,2021,"Saudi Journal of Biological Sciences 28 (1), 825-832, 2021",Saudi Journal of Biological Sciences,28,1,825832
Characteristics of cellulose microfibers and nanocrystals isolated from doum tree (Chamaerops humilis var. argentea),2021,"Cellulose 28, 4089-4103, 2021",Cellulose,28,,40894103
Engineering of highly Brachychiton populneus shells@ polyaniline bio-sorbent for efficient removal of pesticides from wastewater: Optimization using BBD-RSM approach,2022,"Journal of Molecular Liquids 346, 117092, 2022",Journal of Molecular Liquids,346,,117092
Pathogens evolution during the composting of the household waste mixture enriched with phosphate residues and olive oil mill wastewater,2020,"Waste and Biomass Valorization 11, 1789-1797, 2020",Waste and Biomass Valorization,11,,17891797
"Can the application of graphene oxide contribute to the fight against COVID-19? Antiviral activity, diagnosis and prevention",2021,"Current Research in Pharmacology and Drug Discovery 2 (100062), 2021",Current Research in Pharmacology and Drug Discovery,2,100062,
Therapeutic potential of polyphenols in the management of diabetic neuropathy,2021,"Evidence-Based Complementary and Alternative Medicine 2021, 1-20, 2021",Evidence-Based Complementary and Alternative Medicine,2021,,120
