Article_Title,Year,Description,Revue,Volume,Number,Pages
Molecular characterization and genetic relationships among most common identified morphotypes of critically endangered rare Moroccan species Argania spinosa (Sapotaceae) using …,2008,"Annals of Forest Science 65 (8), 1, 2008",Annals of Forest Science,65,8,1
Challenges for drought assessment in the Mediterranean region under future climate scenarios,2020,"Earth-Science Reviews 210, 103348, 2020",Earth-Science Reviews,210,,103348
Assessment of soil contamination around an abandoned mine in a semi-arid environment using geochemistry and geostatistics: pre-work of geochemical process modeling with …,2013,"Journal of Geochemical Exploration 125, 117-129, 2013",Journal of Geochemical Exploration,125,,117129
An integrated modelling and remote sensing approach for hydrological study in arid and semi‐arid regions: the SUDMED Programme,2008,"International Journal of Remote Sensing 29 (17-18), 5161-5181, 2008",International Journal of Remote Sensing,29,1718,51615181
Assessment of daily MODIS snow cover products to monitor snow cover dynamics over the Moroccan Atlas mountain range,2015,"Remote Sensing of Environment 160, 72-86, 2015",Remote Sensing of Environment,160,,7286
"Climate change impacts on surface water resources in the Rheraya catchment (High Atlas, Morocco)",2017,"Hydrological sciences journal 62 (6), 979-995, 2017",Hydrological sciences journal,62,6,979995
Remote sensing of water resources in semi-arid Mediterranean areas: The joint international laboratory TREMA,2015,"International Journal of Remote Sensing 36 (19-20), 4879-4917, 2015",International Journal of Remote Sensing,36,1920,48794917
Different sensitivities of snowpacks to warming in Mediterranean climate mountain areas,2017,"Environmental Research Letters 12 (7), 074006, 2017",Environmental Research Letters,12,7,074006
Evaluation of the snowmelt runoff model in the Moroccan High Atlas Mountains using two snow-cover estimates,2009,"Hydrological sciences journal 54 (6), 1094-1113, 2009",Hydrological sciences journal,54,6,10941113
Earth Observation products for operational irrigation management in the context of the PLEIADeS project,2010,"Agricultural water management 98 (2), 271-282, 2010",Agricultural water management,98,2,271282
Evaluation of TRMM 3B42 V7 Rainfall Product over the Oum Er Rbia Watershed in Morocco,2017,"Climate 5 (1), 2017",Climate,5,1,
Future scenarios of surface water resources availability in North African dams,2018,"Water Resources Management 32, 1291-1306, 2018",Water Resources Management,32,,12911306
Citrus orchard evapotranspiration: comparison between eddy covariance measurements and the FAO-56 approach estimates,2009,"Plant Biosystems 143 (1), 201-208, 2009",Plant Biosystems,143,1,201208
A combined high and low spatial resolution approach for mapping snow covered areas in the Atlas mountains,2005,"International Journal of Remote Sensing 26 (13), 2755-2777, 2005",International Journal of Remote Sensing,26,13,27552777
GIS-based environmental database for assessing the mine pollution: A case study of an abandoned mine site in Morocco,2014,"Journal of Geochemical Exploration 144, 468-477, 2014",Journal of Geochemical Exploration,144,,468477
Evaluation of satellite-based rainfall products for hydrological modelling in Morocco,2016,"Hydrological sciences journal 61 (14), 2509-2519, 2016",Hydrological sciences journal,61,14,25092519
Trends in flow intermittence for European rivers,2021,"Hydrological Sciences Journal 66 (1), 37-49, 2021",Hydrological Sciences Journal,66,1,3749
Energy fluxes and melt rate of a seasonal snow cover in the Moroccan High Atlas,2016,"Hydrological Sciences Journal 61 (5), 931-943, 2016",Hydrological Sciences Journal,61,5,931943
Long-term analysis of snow-covered area in the Moroccan High-Atlas through remote sensing,2010,"International Journal of Applied Earth Observation and Geoinformation 12 …, 2010",International Journal of Applied Earth Observation and Geoinformation,12,,
Isotopic signatures for the assessment of snow water resources in the Moroccan high Atlas mountains: contribution to surface and groundwater recharge,2016,"Environmental Earth Sciences 75, 1-11, 2016",Environmental Earth Sciences,75,,111
Effect of digital elevation model resolution on the simulation of the snow cover evolution in the High Atlas,2019,"Water Resources Research 55 (7), 5360-5378, 2019",Water Resources Research,55,7,53605378
"An efficient and reusable heterogeneous catalyst animal bone meal for facile synthesis of benzimidazoles, benzoxazoles, and benzothiazoles",2011,"Tetrahedron letters 52 (27), 3492-3495, 2011",Tetrahedron letters,52,27,34923495
Removal of two textile dyes from aqueous solutions onto calcined bones,2013,"Journal of the Association of Arab Universities for Basic and Applied …, 2013","Journal of the Association of Arab Universities for Basic and Applied …,",,,
Use of response factorial design for process optimization of basic dye adsorption onto activated carbon derived from Persea species,2017,"Microchemical Journal 130, 129-136, 2017",Microchemical Journal,130,,129136
"Calcined eggshells as a new biosorbent to remove basic dye from aqueous solutions: thermodynamics, kinetics, isotherms and error analysis",2014,"Journal of the Taiwan Institute of Chemical Engineers 45 (4), 1578-1587, 2014",Journal of the Taiwan Institute of Chemical Engineers,45,4,15781587
"Removal of Basic Fuchsin dye from water using mussel shell biomass waste as an adsorbent: Equilibrium, kinetics, and thermodynamics",2016,"Journal of Taibah University for Science 10 (5), 664-674, 2016",Journal of Taibah University for Science,10,5,664674
Calcined mussel shells as a new and eco-friendly biosorbent to remove textile dyes from aqueous solutions,2014,"Journal of the Taiwan Institute of Chemical Engineers 45 (2), 533-540, 2014",Journal of the Taiwan Institute of Chemical Engineers,45,2,533540
Use of Fenton reagent as advanced oxidative process for removing textile dyes from aqueous solutions,2014,"J Mater Environ Sci 5 (3), 667-674, 2014",J Mater Environ Sci,5,3,667674
Removal of a cationic dye–Basic Red 12–from aqueous solution by adsorption onto animal bone meal,2012,"Journal of the Association of Arab Universities for Basic and Applied …, 2012","Journal of the Association of Arab Universities for Basic and Applied …,",,,
Assessment of the biosorption kinetic and thermodynamic for the removal of safranin dye from aqueous solutions using calcined mussel shells,2014,"Journal of Industrial and Engineering Chemistry 20 (2), 717-724, 2014",Journal of Industrial and Engineering Chemistry,20,2,717724
Animal bone meal as an efficient catalyst for crossed-aldol condensation,2010,"Tetrahedron Letters 51 (51), 6715-6717, 2010",Tetrahedron Letters,51,51,67156717
Experimental and theoretical study using DFT method for the competitive adsorption of two cationic dyes from wastewaters,2016,"Applied Surface Science 390, 311-319, 2016",Applied Surface Science,390,,311319
Evaluation of potential capability of calcined bones on the biosorption removal efficiency of safranin as cationic dye from aqueous solutions,2013,"Journal of the Taiwan Institute of Chemical Engineers 44 (1), 13-18, 2013",Journal of the Taiwan Institute of Chemical Engineers,44,1,1318
Insight into adsorption mechanism of Congo red dye onto Bombax Buonopozense bark Activated-carbon using Central composite design and DFT studies,2021,"Surfaces and interfaces 23, 100977, 2021",Surfaces and interfaces,23,,100977
Potential use of activated carbon derived from Persea species under alkaline conditions for removing cationic dye from wastewaters,2017,"Journal of the Association of Arab Universities for Basic and Applied …, 2017","Journal of the Association of Arab Universities for Basic and Applied …,",,,
Competitive adsorption and optimization of binary mixture of textile dyes: A factorial design analysis,2017,"Journal of the Association of Arab Universities for Basic and Applied …, 2017","Journal of the Association of Arab Universities for Basic and Applied …,",,,
Removal of a cationic dye-Methylene Blue-from aqueous media by the use of animal bone meal as a new low cost adsorbent,2011,"J. Mater. Environ. Sci 2 (1), 77-87, 2011",J. Mater. Environ. Sci,2,1,7787
Removal of Basic Blue 41 dyes using Persea americana-activated carbon prepared by phosphoric acid action,2017,"International Journal of Industrial Chemistry 8, 187-195, 2017",International Journal of Industrial Chemistry,8,,187195
"Selective and competitive removal of three basic dyes from single, binary and ternary systems in aqueous solutions: A combined experimental and theoretical study",2020,"Journal of Saudi Chemical Society 24 (7), 527-544, 2020",Journal of Saudi Chemical Society,24,7,527544
Adsorptive removal of anionic dye from aqueous solutions using powdered and calcined vegetables wastes as low-cost adsorbent,2018,"Arab Journal of Basic and Applied Sciences 25 (3), 93-102, 2018",Arab Journal of Basic and Applied Sciences,25,3,93102
Evaluation of performance of animal bone meal as a new low cost adsorbent for the removal of a cationic dye Rhodamine B from aqueous solutions,2016,"Journal of Saudi Chemical Society 20, S53-S59, 2016",Journal of Saudi Chemical Society,20,,5359
Molecular identification of commercialized medicinal plants in Southern Morocco,2012,"PloS one 7 (6), e39459, 2012",PloS one,7,6,39459
"Chemical composition, antioxidant and antimicrobial activities of essential oils obtained from wild and cultivated Moroccan Thymus species",2013,"Industrial Crops and Products 43, 450-456, 2013",Industrial Crops and Products,43,,450456
Chemical characterization and antifungal activities of four Thymus species essential oils against postharvest fungal pathogens of citrus,2016,"Industrial Crops and Products 86, 95-101, 2016",Industrial Crops and Products,86,,95101
"Salt stress effects on germination, growth and essential oil content of an endemic thyme species in Morocco (Thymus maroccanus Ball.).",2009,"Journal of applied sciences research, 858-863, 2009","Journal of applied sciences research,",858863,,
Physico-chemical characterization and effects of olive oil mill wastewaters fertirrigation on growth of some mediterranean crops,2004,"Agronomy Journal 3, 247-254, 2004",Agronomy Journal,3,,247254
Chemical Composition and Antioxidant and Anticandidal Activities of Essential Oils from Different Wild Moroccan Thymus Species,2012,"Chemistry & biodiversity 9 (6), 1188-1197, 2012",Chemistry & biodiversity,9,6,11881197
Antioxidant activity and evidence for synergism of Cannabis sativa (L.) essential oil with antimicrobial standards,2019,"Industrial Crops and Products 137, 396-400, 2019",Industrial Crops and Products,137,,396400
Phenological changes to the chemical composition and biological activity of the essential oil from Moroccan endemic thyme (Thymus maroccanus Ball),2013,"Industrial Crops and Products 49, 366-372, 2013",Industrial Crops and Products,49,,366372
Antioxidative activity and synergistic effect of Thymus saturejoides Coss. essential oils with cefixime against selected food-borne bacteria,2014,"Industrial Crops and Products 61, 338-344, 2014",Industrial Crops and Products,61,,338344
"Assessment of the Food Habits of the Moroccan Dorcas Gazelle in M’Sabih Talaa, West Central Morocco, Using the trnL Approach",2012,"PLoS One 7 (4), e35643, 2012",PLoS One,7,4,35643
DNA barcoding reveals limited accuracy of identifications based on folk taxonomy,2014,"PLoS One 9 (1), e84291, 2014",PLoS One,9,1,84291
"Essential oil composition, antioxidant and antibacterial activities of wild and cultivated Lavandula mairei Humbert",2018,"Biochemical Systematics and Ecology 76, 1-7, 2018",Biochemical Systematics and Ecology,76,,17
Botanical identification of medicinal roots collected and traded in Morocco and comparison to the existing literature,2013,"Journal of ethnobiology and ethnomedicine 9 (1), 1-13, 2013",Journal of ethnobiology and ethnomedicine,9,1,113
Comparative evaluation of antioxidant and insecticidal properties of essential oils from five Moroccan aromatic herbs,2015,"Journal of food science and technology 52, 2312-2319, 2015",Journal of food science and technology,52,,23122319
Species substitution in medicinal roots and possible implications for toxicity of herbal remedies in Morocco,2012,"Economic botany 66, 370-382, 2012",Economic botany,66,,370382
Chenopodium ambrosioides var. ambrosioides used in Moroccan traditional medicine can enhance the antimicrobial activity of conventional antibiotics,2015,"Industrial Crops and products 71, 37-43, 2015",Industrial Crops and products,71,,3743
Germination responses of the Mediterranean saltbush (Atriplex halimus L.) to NaCl treatment,2004,"Journal of Agronomy (Pakistan) 3 (2), 2004",Journal of Agronomy (Pakistan),3,2,
Chemical Characterization and Insecticidal Properties of Essential Oils from Different Wild Populations of Mentha suaveolens subsp. timija (Briq.) Harley from …,2015,"Chemistry & Biodiversity 12 (5), 823-831, 2015",Chemistry & Biodiversity,12,5,823831
"Chemical composition, antioxidant and insecticidal properties of essential oils from wild and cultivated Salvia aucheri subsp. blancoana (Webb. & Helder)), an endemic …",2014,"Industrial Crops and Products 57, 106-109, 2014",Industrial Crops and Products,57,,106109
"Chemical composition, antimicrobial activities and synergistic effects of essential oil from Senecio anteuphorbium, a Moroccan endemic plant",2019,"Industrial crops and products 130, 310-315, 2019",Industrial crops and products,130,,310315
"Glyphosate based-herbicide exposure affects gut microbiota, anxiety and depression-like behaviors in mice",2018,"Neurotoxicology and teratology 67, 44-49, 2018",Neurotoxicology and teratology,67,,4449
"Effects of single cage housing on stress, cognitive, and seizure parameters in the rat and mouse pilocarpine models of epilepsy",2019,"Eneuro 6 (4), 2019",Eneuro,6,4,
The absence of melanopsin alters retinal clock function and dopamine regulation by light,2013,"Cellular and molecular life sciences 70, 3435-3447, 2013",Cellular and molecular life sciences,70,,34353447
Behavioral and immunohistochemical study of the effects of subchronic and chronic exposure to glyphosate in mice,2017,"Frontiers in Behavioral Neuroscience 11, 146, 2017",Frontiers in Behavioral Neuroscience,11,,146
Learning and memory impairments associated to acetylcholinesterase inhibition and oxidative stress following glyphosate based-herbicide exposure in mice,2019,"Toxicology 415, 18-25, 2019",Toxicology,415,,1825
Evaluation of the developmental toxicity of the aqueous extract from Trigonella foenum-graecum (L.) in mice,2010,"Journal of ethnopharmacology 131 (2), 321-325, 2010",Journal of ethnopharmacology,131,2,321325
"Anti-inflammatory, Antinociceptive, and Antioxidant Activities of Methanol and Aqueous Extracts of Anacyclus pyrethrum Roots",2017,"Frontiers in pharmacology 8, 598, 2017",Frontiers in pharmacology,8,,598
Neonatal 6-OHDA lesion model in mouse induces Attention-Deficit/Hyperactivity Disorder (ADHD)-like behaviour,2018,"Scientific reports 8 (1), 15349, 2018",Scientific reports,8,1,15349
Pre-and postnatal exposure to glyphosate-based herbicide causes behavioral and cognitive impairments in adult mice: Evidence of cortical ad hippocampal dysfunction,2020,"Archives of toxicology 94, 1703-1723, 2020",Archives of toxicology,94,,17031723
Distribution of GABA immunoreactive systems in the forebrain and midbrain of the chameleon,1991,"Brain research bulletin 26 (6), 891-898, 1991",Brain research bulletin,26,6,891898
Role of the calcium modulated cyclases in the development of the retinal projections,2006,"European Journal of Neuroscience 24 (12), 3401-3414, 2006",European Journal of Neuroscience,24,12,34013414
Existence of a GnRH immunoreactive nucleus in the dorsal midbrain tegmentum of the chameleon,1989,"General and comparative endocrinology 75 (2), 195-203, 1989",General and comparative endocrinology,75,2,195203
Existence of a GnRH immunoreactive nucleus in the dorsal midbrain tegmentum of the chameleon,1989,"General and comparative endocrinology 75 (2), 195-203, 1989",General and comparative endocrinology,75,2,195203
Mice lacking Period 1 and Period 2 circadian clock genes exhibit blue cone photoreceptor defects,2013,"European Journal of Neuroscience 37 (7), 1048-1060, 2013",European Journal of Neuroscience,37,7,10481060
Sensorimotor cortex projections to the ventrolateral and the dorsomedial medulla oblongata in the rat,1993,"Neuroscience letters 164 (1-2), 195-198, 1993",Neuroscience letters,164,12,195198
"The distribution of 5-HT immunoreactive systems in the brain of a saurian, the chameleon.",1990,"Journal fur Hirnforschung 31 (5), 563-574, 1990",Journal fur Hirnforschung,31,5,563574
The developmental neurobehavioral effects of fenugreek seeds on prenatally exposed mice,2012,"Journal of ethnopharmacology 139 (2), 672-677, 2012",Journal of ethnopharmacology,139,2,672677
Diabetic retinopathy alters light-induced clock gene expression and dopamine levels in the mouse retina,2016,"Molecular vision 22, 959, 2016",Molecular vision,22,,959
Behavioral and cognitive changes after early postnatal lesions of the rat mediodorsal thalamus,2015,"Behavioural brain research 292, 219-232, 2015",Behavioural brain research,292,,219232
Clock genes and behavioral responses to light are altered in a mouse model of diabetic retinopathy,2014,"PLoS One 9 (7), e101584, 2014",PLoS One,9,7,101584
Microstructure and physical properties of lime-clayey adobe bricks,2008,"Construction and Building Materials 22 (12), 2386-2392, 2008",Construction and Building Materials,22,12,23862392
Mineralogy and firing characteristics of a clay from the valley of Ourika (Morocco),2002,"Applied Clay Science 21 (3-4), 203-212, 2002",Applied Clay Science,21,34,203212
Removal of methylene blue from aqueous solution by fibrous clay minerals,2006,"Journal of hazardous materials 135 (1-3), 188-192, 2006",Journal of hazardous materials,135,13,188192
Adsorption of methylene blue and zinc ions on raw and acid-activated bentonite from Morocco,2009,"Applied Clay Science 46 (4), 418-421, 2009",Applied Clay Science,46,4,418421
Chemical and mineralogical characterization of a clay taken from the Moroccan Meseta and a study of the interaction between its fine fraction and methylene blue,2001,"applied clay science 20 (1-2), 1-12, 2001",applied clay science,20,12,112
Phosphate sludge: thermal transformation and use as lightweight aggregate material,2013,"Journal of environmental management 130, 354-360, 2013",Journal of environmental management,130,,354360
"Physical properties, microstructure and mineralogy of termite mound material considered as construction materials",2011,"Applied Clay Science 52 (1-2), 160-164, 2011",Applied Clay Science,52,12,160164
A Chloritic-illitic clay from Morocco: Temperature–time–transformation and neoformation,2009,"Applied Clay Science 45 (1-2), 83-89, 2009",Applied Clay Science,45,12,8389
Effects of two mixtures of kaolin-talc-bauxite and firing temperatures on the characteristics of cordierite-based ceramics,2016,"Journal of Building Engineering 8, 99-106, 2016",Journal of Building Engineering,8,,99106
Effects of some processing factors on technical properties of a clay-based ceramic material,2012,"Applied Clay Science 65, 106-113, 2012",Applied Clay Science,65,,106113
Cement-lateritic gravels mixtures: Microstructure and strength characteristics,2008,"Construction and building materials 22 (10), 2078-2086, 2008",Construction and building materials,22,10,20782086
Sintering mechanism and ceramic phases of an illitic–chloritic raw clay,2006,"Journal of the European Ceramic Society 26 (1-2), 161-167, 2006",Journal of the European Ceramic Society,26,12,161167
Effects of the experimental factors on the microstructure and the properties of cured alkali-activated heated clay,2015,"Applied Clay Science 116, 202-210, 2015",Applied Clay Science,116,,202210
Influence of NaOH concentration on microstructure and properties of cured alkali-activated calcined clay,2017,"Journal of Building Engineering 11, 158-165, 2017",Journal of Building Engineering,11,,158165
Evaluation of the simultaneous effects of firing cycle parameters on technological properties and ceramic suitability of a raw clay using the response surface methodology,2006,"Journal of the American Ceramic Society 89 (5), 1563-1567, 2006",Journal of the American Ceramic Society,89,5,15631567
"A calcareous clay from Tamesloht (Al Haouz, Morocco): Properties and thermal transformations",2011,"Applied clay science 51 (4), 507-510, 2011",Applied clay science,51,4,507510
Clay-calcite mixes: sintering and phase formation,2004,"British ceramic transactions 103 (1), 29-32, 2004",British ceramic transactions,103,1,2932
Dendrimers and hyper-branched polymers interacting with clays: fruitful associations for functional materials,2019,"Journal of Materials Chemistry A 7 (34), 19634-19650, 2019",Journal of Materials Chemistry A,7,34,1963419650
Microstructural characterisation and physical properties of cured thermally activated clay-lime blends,2012,"Construction and Building Materials 26 (1), 226-232, 2012",Construction and Building Materials,26,1,226232
Microstructural characterization and influence of manufacturing parameters on technological properties of vitreous ceramic materials,2010,"Materials characterization 61 (3), 289-295, 2010",Materials characterization,61,3,289295
Experimental and theoretical study of a humidification-dehumidification water desalination system using solar energy,2004,"Desalination 168, 151-159, 2004",Desalination,168,,151159
Experimental and numerical study of an earth-to-air heat exchanger for air cooling in a residential building in hot semi-arid climate,2016,"Energy and Buildings 125, 109-121, 2016",Energy and Buildings,125,,109121
Thermomechanical characterization of a bio-composite building material: Mortar reinforced with date palm fibers mesh,2017,"Construction and Building Materials 135, 241-250, 2017",Construction and Building Materials,135,,241250
Laminar mixed convection of humid air in a vertical channel with evaporation or condensation at the wall,2004,"International Journal of Thermal Sciences 43 (6), 531-539, 2004",International Journal of Thermal Sciences,43,6,531539
Moisture content influence on the thermal conductivity of insulating building materials made from date palm fibers mesh,2017,"Construction and Building Materials 148, 811-823, 2017",Construction and Building Materials,148,,811823
Buoyancy effects on upward and downward laminar mixed convection heat and mass transfer in a vertical channel,2007,"International Journal of Numerical Methods for Heat & Fluid Flow, 2007","International Journal of Numerical Methods for Heat & Fluid Flow,",,,
Experimental and numerical study of mixed convection heat and mass transfer in a vertical channel with film evaporation,2011,"International Journal of Thermal Sciences 50 (6), 942-953, 2011",International Journal of Thermal Sciences,50,6,942953
Thermal performance assessment of passive techniques integrated into a residential building in semi-arid climate,2017,"Energy and Buildings 143, 1-16, 2017",Energy and Buildings,143,,116
Stability and thermal conductivity enhancement of aqueous nanofluid based on surfactant-modified TiO2,2019,"Journal of Dispersion Science and Technology, 2019","Journal of Dispersion Science and Technology,",,,
Preparation and characterization of nano‐enhanced myristic acid using metal oxide nanoparticles for thermal energy storage,2019,"International journal of energy research 43 (14), 8592-8607, 2019",International journal of energy research,43,14,85928607
Energy performances of a passive building in Marrakech: parametric study,2013,"Energy procedia 42, 624-632, 2013",Energy procedia,42,,624632
Experimental assessment of thermal performance of three passive cooling techniques for roofs in a semi-arid climate,2018,"Energy and Buildings 164, 153-164, 2018",Energy and Buildings,164,,153164
Flow reversal in combined laminar mixed convection heat and mass transfer with phase change in a vertical channel,2010,"International journal of heat and fluid flow 31 (4), 711-721, 2010",International journal of heat and fluid flow,31,4,711721
Thermal characterization of a Tunisian gypsum plaster as construction material,2013,"Energy Procedia 42, 680-688, 2013",Energy Procedia,42,,680688
Thermal behavior and energy saving analysis of a flat with different energy efficiency measures in six climates,2018,"Building Simulation 11 (6), 1123-1144, 2018",Building Simulation,11,6,11231144
A numerical study of the longitudinal thermoconvective rolls in a mixed convection flow in a horizontal channel with a free surface,2013,"International journal of heat and fluid flow 42, 265-277, 2013",International journal of heat and fluid flow,42,,265277
Mixed Convection Heat and Mass Transfer with Phase Change and Flow Reversal in Channels,2011,"Chap. in Book ""Mass transfer in multiphase systems and its applications …, 2011","Chap. in Book ""Mass transfer in multiphase systems and its applications …,",,,
Combined buoyancy effects of thermal and mass diffusion on laminar convection in a vertical isothermal channel,2010,"Computational Thermal Sciences: An International Journal 2 (2), 2010",Computational Thermal Sciences: An International Journal,2,2,
Analysis for thermal behavior and energy savings of a semi-detached house with different insulation strategies in a hot semi-arid climate,2017,"Journal of Green Building 12 (1), 78-106, 2017",Journal of Green Building,12,1,78106
Mechanical and thermophysical properties of compressed earth brick rienforced by raw and treated doum fibers,2022,"Construction and Building Materials 318, 126031, 2022",Construction and Building Materials,318,,126031
